{
  "id": "event_asura_gondwana_intervention",
  "type": "event",
  "title": "The Asura Gondwana Intervention",
  "epoch": "epoch_prehistoric",
  "participants": [
    "mythology_ammonite_man",
    "character_owlman"
  ],
  "location": "region_ganges_lava_sea",
  "predecessors": [
    "event_fang_vs_scale_wars"
  ],
  "successors": [],
  "causes": [
    "primordial_rift_opens",
    "asura_loka_radiation_spill"
  ],
  "outcomes": [
    "feathers_evolve_as_thermal_vents",
    "avian_dinosaurids_arise",
    "synapsid_lineages_corrupted",
    "rift_stabilises_as_ganges_lava_sea"
  ],
  "summary": "An unstabilised rift into Asura Loka floods the Gondwana battlefield with mutagenic energy. The diapsids shed the heat as feathers and become the first avian dinosaurids; some synapsid predators degenerate into the shadow-corrupted lineages the Tendua descends from. The rift hardens into the Ganges Lava Sea.",
  "canon": "primary",
  "sources": [
    "dump/fang-vs-scale-wars.md",
    "AI_CONTEXT.md"
  ]
}
