{
  "id": "event_the_last_puja",
  "type": "event",
  "title": "The Last Puja",
  "epoch": "epoch_post_cataclysm",
  "participants": [],
  "location": "field_map_aravali",
  "predecessors": [
    "event_aravali_massacre"
  ],
  "successors": [],
  "causes": [
    "the line over the strait fell out of use",
    "no passengers, and so no alms",
    "no purohits left to keep the puja"
  ],
  "outcomes": [
    "the temple left unrepaired, and in time the dome split and came down",
    "the plinth and the names of the Jharwa dead cut along it left standing, untended"
  ],
  "summary": "The temple raised over the Jharwa dead is abandoned. Nothing sacks it and nothing burns it: the crossing goes quiet, the alms stop, the purohits leave, and there is no one left to pay for repairs. The dome goes first. The plinth, and the names along it, outlast the building that was the offering.",
  "canon": "primary",
  "sources": [
    "owner backstory, 2026-09-11"
  ]
}
